{
  "specification": {
    "standard": "DDT-PRESERVATION-CONTRACT",
    "version": "0.3.0-draft.1"
  },
  "contractId": "ddt.reference-recorder.preservation-contract",
  "contractVersion": "0.3.0-draft.2",
  "artifacts": {
    "envelopeSchema": {
      "artifactId": "DDT-ENVELOPE-SCHEMA-0.3-DRAFT.5",
      "version": "0.3.0-draft.5",
      "digest": {
        "algorithm": "SHA-256",
        "value": "3b6518e2541fc04b5f5ef6227f6aa9e1bdc0442044742ee02ed6541c6bd02310"
      },
      "immutableRef": "schemas/ddt-record-envelope-v0.3-draft.5.schema.json",
      "mediaType": "application/json"
    },
    "enterpriseProfile": {
      "artifactId": "DDT-ENTERPRISE-REFERENCE-RECORDER-PROFILE-0.2-DRAFT.2",
      "version": "0.2.0-draft.2",
      "digest": {
        "algorithm": "SHA-256",
        "value": "69963c3a403f89e0580112451ddd8b42af024f6cf2c17f43496a095d50c0efcf"
      },
      "immutableRef": "profiles/enterprise/ddt-reference-recorder-enterprise-profile-v0.2-draft.2.json",
      "mediaType": "application/json"
    },
    "validationRuleSet": {
      "artifactId": "DDT-ENTERPRISE-REFERENCE-RECORDER-VALIDATION-RULESET-0.1-DRAFT.1",
      "version": "0.1.0-draft.1",
      "digest": {
        "algorithm": "SHA-256",
        "value": "6211edf15ff1094b4200d48952a1e4f1eb9659e9b73c998135b82d0a96c3d585"
      },
      "immutableRef": "profiles/enterprise/rules/ddt-reference-recorder-validation-rules-v0.1.json",
      "mediaType": "application/json"
    },
    "canonicalizationProfile": {
      "artifactId": "DDT-CANONICALIZATION-PROFILE-ARTIFACT-0.1-DRAFT.1",
      "version": "0.1.0-draft.1",
      "digest": {
        "algorithm": "SHA-256",
        "value": "988a4b770177ebfb595de9c2e286a76cd4b4f108e8cffdd0844656d03d2f443e"
      },
      "immutableRef": "profiles/ddt-canonicalization-profile-v0.1.json",
      "mediaType": "application/json"
    },
    "structuralCommitmentProfile": {
      "artifactId": "DDT-STRUCTURAL-COMMITMENT-PROFILE-ARTIFACT-0.1-DRAFT.1",
      "version": "0.1.0-draft.1",
      "digest": {
        "algorithm": "SHA-256",
        "value": "60c73c543e4e86f478c24042abb4a01ad920b675b709607e455cec113089e825"
      },
      "immutableRef": "profiles/ddt-structural-commitment-profile-v0.1.json",
      "mediaType": "application/json"
    },
    "identifierProfile": {
      "artifactId": "DDT-IDENTIFIER-PROFILE-ARTIFACT-0.1-DRAFT.1",
      "version": "0.1.0-draft.1",
      "digest": {
        "algorithm": "SHA-256",
        "value": "a4f88a9936cab3d8a957bf0c3b7f09aeeff23fc5b322d5b5ce9731372ab30e86"
      },
      "immutableRef": "profiles/ddt-identifier-profile-v0.1.json",
      "mediaType": "application/json"
    },
    "evidenceManifestProfile": {
      "artifactId": "DDT-EVIDENCE-MANIFEST-PROFILE-ARTIFACT-0.1-DRAFT.1",
      "version": "0.1.0-draft.1",
      "digest": {
        "algorithm": "SHA-256",
        "value": "74ea30e4f37cf23851f89b962507d0e2176ac9a1136455c924e274afd10bab51"
      },
      "immutableRef": "profiles/ddt-evidence-manifest-profile-v0.1.json",
      "mediaType": "application/json"
    },
    "relationshipVocabulary": {
      "artifactId": "DDT-BASE-RELATIONSHIP-VOCABULARY-0.1-DRAFT.1",
      "version": "0.1.0-draft.1",
      "digest": {
        "algorithm": "SHA-256",
        "value": "87a50bd36dc0739389609e2bed1b885396d950d719307fedde2092b15d3dd56e"
      },
      "immutableRef": "profiles/ddt-base-relationship-vocabulary-v0.1.json",
      "mediaType": "application/json"
    },
    "registrationSignatureProfile": {
      "artifactId": "DDT-ED25519-SIGNATURE-PROFILE-0.2-DRAFT.1",
      "version": "0.2.0-draft.1",
      "digest": {
        "algorithm": "SHA-256",
        "value": "1718a4a2bc3deaff5f3648838d47b506b045a3603146456f2ee5d9c13d8342ce"
      },
      "immutableRef": "profiles/ddt-ed25519-signature-profile-v0.2.json",
      "mediaType": "application/json"
    },
    "conformanceReceiptProfile": {
      "artifactId": "DDT-REFERENCE-RECORDER-CONFORMANCE-RECEIPT-PROFILE-0.1-DRAFT.1",
      "version": "0.1.0-draft.1",
      "digest": {
        "algorithm": "SHA-256",
        "value": "e6a16958f8df03320de6c6a26e2497c33f67312ff3a9fab31a942cabf20e65e6"
      },
      "immutableRef": "profiles/ddt-reference-recorder-conformance-receipt-profile-v0.1.json",
      "mediaType": "application/json"
    },
    "verificationResultProfile": {
      "artifactId": "DDT-VERIFICATION-RESULT-0.2-DRAFT.1",
      "version": "0.2.0-draft.1",
      "digest": {
        "algorithm": "SHA-256",
        "value": "04608e0af8ec44abcf91a1b1ac8f44615719888c731e1aac130ec9a508c34b40"
      },
      "immutableRef": "specs/DDT_VERIFICATION_RESULT_V0.2_DRAFT.md",
      "mediaType": "text/markdown"
    },
    "verificationAxisRegistry": {
      "artifactId": "DDT-VERIFICATION-AXIS-REGISTRY-0.2-DRAFT.1",
      "version": "0.2.0-draft.1",
      "digest": {
        "algorithm": "SHA-256",
        "value": "adc0c50393cf0e285c0732dcc4dcd0ed777776f5e8be52caef0b58fbeaf737a6"
      },
      "immutableRef": "profiles/ddt-verification-axis-registry-v0.2.json",
      "mediaType": "application/json"
    },
    "verificationReasonCodeRegistry": {
      "artifactId": "DDT-VERIFICATION-REASON-CODE-REGISTRY-0.2-DRAFT.1",
      "version": "0.2.0-draft.1",
      "digest": {
        "algorithm": "SHA-256",
        "value": "f5f1e7310439c8407f14942da6e4d71d808fa120d41ab7fe2a5d95050e8e0d35"
      },
      "immutableRef": "profiles/ddt-verification-reason-code-registry-v0.2.json",
      "mediaType": "application/json"
    }
  },
  "normativeDependencies": {
    "artifacts": [
      {
        "artifactId": "DDC-TRS-2.0-DRAFT.1",
        "version": "2.0.0-draft.1",
        "digest": {
          "algorithm": "SHA-256",
          "value": "bdd5eb95cd0bed12646b6cea66083b21c36c42bfeea171c01a96f951986268c2"
        },
        "immutableRef": "specs/DDC_TOKEN_RECORD_STANDARD_V2.0_DRAFT.md",
        "mediaType": "text/markdown"
      },
      {
        "artifactId": "DDT-BASE-RELATIONSHIP-VOCABULARY-0.1-DRAFT.1",
        "version": "0.1.0-draft.1",
        "digest": {
          "algorithm": "SHA-256",
          "value": "87a50bd36dc0739389609e2bed1b885396d950d719307fedde2092b15d3dd56e"
        },
        "immutableRef": "profiles/ddt-base-relationship-vocabulary-v0.1.json",
        "mediaType": "application/json"
      },
      {
        "artifactId": "DDT-CANONICALIZATION-PROFILE-0.1-DRAFT.1",
        "version": "0.1.0-draft.1",
        "digest": {
          "algorithm": "SHA-256",
          "value": "7df86210f5ba60c42b31566a6c28bfaf834485f78871f937a5a518a5f7d09389"
        },
        "immutableRef": "specs/DDT_CANONICALIZATION_PROFILE_V0.1_DRAFT.md",
        "mediaType": "text/markdown"
      },
      {
        "artifactId": "DDT-CANONICALIZATION-PROFILE-ARTIFACT-0.1-DRAFT.1",
        "version": "0.1.0-draft.1",
        "digest": {
          "algorithm": "SHA-256",
          "value": "988a4b770177ebfb595de9c2e286a76cd4b4f108e8cffdd0844656d03d2f443e"
        },
        "immutableRef": "profiles/ddt-canonicalization-profile-v0.1.json",
        "mediaType": "application/json"
      },
      {
        "artifactId": "DDT-CANONICALIZATION-PROFILE-SCHEMA-0.1-DRAFT.1",
        "version": "0.1.0-draft.1",
        "digest": {
          "algorithm": "SHA-256",
          "value": "f385156e9989918a353e90fe4a8312b17d8b69ec1c9ccfec50453cc0c0a4750d"
        },
        "immutableRef": "schemas/ddt-canonicalization-profile-v0.1.schema.json",
        "mediaType": "application/json"
      },
      {
        "artifactId": "DDT-CONFORMANCE-RECEIPT-0.3-DRAFT.1",
        "version": "0.3.0-draft.1",
        "digest": {
          "algorithm": "SHA-256",
          "value": "ce9d6fd957a5378818a4a86f9812efac198240c5404d80852f3ffdb83c0ff892"
        },
        "immutableRef": "specs/DDT_CONFORMANCE_RECEIPT_V0.3_DRAFT.md",
        "mediaType": "text/markdown"
      },
      {
        "artifactId": "DDT-CONFORMANCE-RECEIPT-SCHEMA-0.3-DRAFT.1",
        "version": "0.3.0-draft.1",
        "digest": {
          "algorithm": "SHA-256",
          "value": "927108f1e372743b1d5f10a16c2e8b85d650f4c37ca69d4acf26bd7d557e84a8"
        },
        "immutableRef": "schemas/ddt-conformance-receipt-v0.3.schema.json",
        "mediaType": "application/json"
      },
      {
        "artifactId": "DDT-CONFORMANCE-RESULT-DERIVATION-PROFILE-0.1-DRAFT.1",
        "version": "0.1.0-draft.1",
        "digest": {
          "algorithm": "SHA-256",
          "value": "31f0f96ddf7d59d6e524cd67eb339d3265fe6fd2cf94f1f0d2f822232ff46504"
        },
        "immutableRef": "profiles/ddt-conformance-result-derivation-profile-v0.1.json",
        "mediaType": "application/json"
      },
      {
        "artifactId": "DDT-ED25519-SIGNATURE-PROFILE-0.2-DRAFT.1",
        "version": "0.2.0-draft.1",
        "digest": {
          "algorithm": "SHA-256",
          "value": "1718a4a2bc3deaff5f3648838d47b506b045a3603146456f2ee5d9c13d8342ce"
        },
        "immutableRef": "profiles/ddt-ed25519-signature-profile-v0.2.json",
        "mediaType": "application/json"
      },
      {
        "artifactId": "DDT-ENTERPRISE-CONFIDENTIAL-EVIDENCE-COMMITMENT-PROFILE-0.1-DRAFT.1",
        "version": "0.1.0-draft.1",
        "digest": {
          "algorithm": "SHA-256",
          "value": "d741b7edbceeaa49a9274fc799d38ff7911a4631269c328e43fd85028355656c"
        },
        "immutableRef": "profiles/enterprise/ddt-confidential-evidence-commitment-profile-v0.1.json",
        "mediaType": "application/json"
      },
      {
        "artifactId": "DDT-ENTERPRISE-CONFIDENTIAL-EVIDENCE-COMMITMENT-SCHEMA-0.1-DRAFT.1",
        "version": "0.1.0-draft.1",
        "digest": {
          "algorithm": "SHA-256",
          "value": "59d5481cd90411270aaa7cd88837ae10778bec43827350519baa0fe0073e4de8"
        },
        "immutableRef": "schemas/enterprise/ddt-confidential-evidence-commitment-profile-v0.1.schema.json",
        "mediaType": "application/json"
      },
      {
        "artifactId": "DDT-ENTERPRISE-PROFILE-0.2-DRAFT.1",